{
  "name": "SDLC with Checkpoints",
  "description": "Multi-agent SDLC workflow with checkpoint/resume support. Demonstrates hierarchical composition where each generator may be an autonomous agent.",
  "model": "qwen2.5-coder:14b",
  "rmax": 3,
  "action_pairs": {
    "g_config": {
      "generator": "ConfigExtractorGenerator",
      "guard": "config_extracted",
      "description": "Extract project configuration (source_root, package_name) from documentation"
    },
    "g_add": {
      "generator": "ADDGenerator",
      "guard": "architecture_tests_valid",
      "guard_config": {
        "min_tests": 1
      },
      "requires": ["g_config"],
      "description": "Generate pytest-arch tests from architecture documentation"
    },
    "g_bdd": {
      "generator": "BDDGenerator",
      "guard": "scenarios_valid",
      "guard_config": {
        "min_scenarios": 1
      },
      "requires": ["g_config"],
      "description": "Generate BDD scenarios (Gherkin) from requirements"
    },
    "g_coder": {
      "generator": "CoderGenerator",
      "guard": "all_tests_pass",
      "guard_config": {
        "workdir": "output"
      },
      "requires": ["g_add", "g_bdd"],
      "description": "Generate implementation that satisfies all tests and scenarios"
    }
  }
}
