{
  "name": "Multi-Agent SDLC",
  "description": "Orchestrates ADD, BDD, and Coder agents for end-to-end development. Demonstrates hierarchical composition (Remark 5) where each generator may be an autonomous Semantic Agent.",
  "model": "qwen2.5-coder:14b",
  "rmax": 3,
  "specification": "Build a feature based on the provided requirements and architecture documentation.",
  "action_pairs": {
    "g_config": {
      "generator": "ConfigExtractorGenerator",
      "generator_config": {
        "prompts_file": "examples/add/prompts.json"
      },
      "guard": "config_extracted",
      "description": "Extract project configuration (source_root, package_name) from documentation"
    },
    "g_add": {
      "generator": "ADDGenerator",
      "generator_config": {
        "min_gates": 3,
        "min_tests": 3,
        "prompts_file": "examples/add/prompts.json",
        "workdir": "examples/sdlc/output"
      },
      "guard": "architecture_tests_valid",
      "guard_config": {
        "min_tests": 1
      },
      "requires": ["g_config"],
      "description": "Generate pytest-arch tests from architecture documentation"
    },
    "g_bdd": {
      "generator": "BDDGenerator",
      "generator_config": {
        "min_scenarios": 3,
        "workdir": "examples/sdlc/output"
      },
      "guard": "scenarios_valid",
      "guard_config": {
        "min_scenarios": 1
      },
      "requires": ["g_config"],
      "description": "Generate BDD scenarios (Gherkin) from requirements"
    },
    "g_coder": {
      "generator": "CoderGenerator",
      "generator_config": {
        "workdir": "examples/sdlc/output"
      },
      "guard": "all_tests_pass",
      "guard_config": {
        "workdir": "examples/sdlc/output"
      },
      "requires": ["g_add", "g_bdd"],
      "description": "Generate implementation that satisfies all tests and scenarios"
    }
  }
}
