{
  "name": "S1 TDD",
  "description": "Experiment 7.2 Arm 3: Analysis, test generation, then fix (3 action pairs, rmax=0).",
  "model": "Qwen/Qwen2.5-Coder-32B-Instruct",
  "rmax": 0,
  "action_pairs": {
    "ap_analysis": {
      "generator": "AnalysisGenerator",
      "guard": "analysis",
      "guard_config": {},
      "description": "Analyze the bug: classify type, identify root cause, list affected files"
    },
    "ap_gen_test": {
      "generator": "TestGenerator",
      "guard": "test_syntax",
      "guard_config": {},
      "requires": ["ap_analysis"],
      "description": "Write a failing test that reproduces the bug"
    },
    "ap_gen_fix": {
      "generator": "PatchGenerator",
      "guard": "patch",
      "guard_config": {
        "require_git_apply": false,
        "require_syntax_valid": true
      },
      "requires": ["ap_analysis", "ap_gen_test"],
      "description": "Generate patch to fix the bug and pass the test"
    }
  }
}
