{
  "name": "SWE-bench Baseline",
  "description": "Minimum viable workflow: localize â†’ patch. No comprehension or characterization.",
  "model": "qwen2.5-coder:14b",
  "rmax": 3,
  "action_pairs": {
    "ap_localize": {
      "generator": "LocalizationGenerator",
      "guard": "localization",
      "guard_config": {
        "require_files": true,
        "min_files": 1,
        "max_files": 5,
        "require_functions": false
      },
      "description": "Identify files and functions to modify"
    },
    "ap_patch": {
      "generator": "PatchGenerator",
      "guard": "patch",
      "guard_config": {
        "require_git_apply": true,
        "require_syntax_valid": true
      },
      "requires": ["ap_localize"],
      "description": "Generate patch to fix the bug"
    }
  }
}
